{
  "bai_sha256": "d78e6cb72528c751d0fc2b9ed709d89223eafd06671c1fa28c03fedba96c5db8",
  "bam_sha256": "138f45585211981e165038cc485f4d14bf840f1e56303642caf6ec8ce07c4cb3",
  "bam_size_bytes": 167947354,
  "completed_families": [
    "reads",
    "coverage",
    "mapping_quality",
    "base_quality",
    "read_length",
    "pairing",
    "alignment",
    "reference_context",
    "spatial",
    "difficulty",
    "variant_evidence"
  ],
  "dataset_id": "minos-practice-chr19-round-11fff0d5",
  "degradation_status": "COMPLETE",
  "fai_sha256": "ce0ee961cd23439f944459c8483b3a11ab58b87e201272862a24d67fb7707805",
  "fingerprint_hash": "82ff3cee87c58395429c98df001fb0cb8eb93460de9641afda852fc7174ffbf6",
  "first_run_elapsed_seconds": 104.59984002704732,
  "first_run_peak_rss_mb": 628.0,
  "hard_limit_met": true,
  "hard_limit_seconds": 300.0,
  "pileup_mode": "ADAPTIVE",
  "profile_schema_hash": "bam-profile-v1",
  "profiler_config_hash": "d01b8e7a9da8e31adad1b9cba17230506771a885256a67ec2e96c74a13c07670",
  "profiler_version": "layer1-profiler-v1",
  "real_bam_qualified": true,
  "reference_sha256": "e00b74f7cd48f6c94395c40ae7b4c13d1c3255e2db1be366eb5a87441577ec5c",
  "region_contig": "chr19",
  "region_end0": 46700000,
  "region_source": "chr19:36800001-46700000",
  "region_start0": 36800000,
  "repeat_run_fingerprint_equal": true,
  "schema_version": "layer1-integration-report-v1",
  "second_run_elapsed_seconds": 107.61639105796348,
  "second_run_peak_rss_mb": 637.74609375,
  "warnings": []
}
